{
  "$schema":"https://json-schema.org/draft/2020-12/schema","$id":"https://cloverapps.ai/schemas/launch-studio/0.1.0/synthetic-session-fixture.schema.json","title":"Complete synthetic owner-only session fixture","type":"object","additionalProperties":false,
  "required":["documentType","schemaVersion","sessionId","workspaceId","projectId","profileId","title","ownerEvents","understandingCheck","contextPack","impactScan","acceptanceContract","buildCharter","syntheticCharterDecision","charterAuthorityReference","executorWorkOrder","executionAuthorityReference","previewProposal","predictedFruit","understandingDelta","sessionBudget","exportMetadata","restorationId","restoredAt","replayId","replayGeneratedAt","personalChatGptMemoryIncluded","rawPrivateDataIncluded","externalEffects","synthetic","consequentialAuthorityGranted"],
  "properties":{"documentType":{"const":"clover-launch-studio-synthetic-session-fixture"},"schemaVersion":{"const":"0.1.0"},"sessionId":{"$ref":"common.schema.json#/$defs/id"},"workspaceId":{"$ref":"common.schema.json#/$defs/id"},"projectId":{"$ref":"common.schema.json#/$defs/id"},"profileId":{"$ref":"common.schema.json#/$defs/id"},"title":{"type":"string","minLength":1},"ownerEvents":{"type":"array","minItems":2,"maxItems":2,"items":{"$ref":"owner-event.schema.json"}},"understandingCheck":{"$ref":"understanding-check.schema.json"},"contextPack":{"$ref":"launch-context-pack.schema.json"},"impactScan":{"$ref":"impact-scan.schema.json"},"acceptanceContract":{"$ref":"acceptance-contract.schema.json"},"buildCharter":{"$ref":"build-charter.schema.json"},"syntheticCharterDecision":{"type":"object","additionalProperties":false,"required":["decisionId","statement","charterId","charterHash","decidedAt","actor","synthetic","nonAuthorizing","consequentialAuthorityGranted"],"properties":{"decisionId":{"$ref":"common.schema.json#/$defs/id"},"statement":{"const":"APPROVE BUILD CHARTER"},"charterId":{"$ref":"common.schema.json#/$defs/id"},"charterHash":{"$ref":"common.schema.json#/$defs/hash"},"decidedAt":{"$ref":"common.schema.json#/$defs/timestamp"},"actor":{"$ref":"common.schema.json#/$defs/actor"},"synthetic":{"const":true},"nonAuthorizing":{"const":true},"consequentialAuthorityGranted":{"const":false}}},"charterAuthorityReference":{"$ref":"authority-reference.schema.json"},"executorWorkOrder":{"$ref":"executor-work-order.schema.json"},"executionAuthorityReference":{"$ref":"authority-reference.schema.json"},"previewProposal":{"$ref":"preview-receipt.schema.json"},"predictedFruit":{"$ref":"fruit-observation.schema.json"},"understandingDelta":{"$ref":"understanding-delta.schema.json"},"sessionBudget":{"$ref":"session-budget.schema.json"},"exportMetadata":{"type":"object","additionalProperties":false,"required":["exportId","sessionId","workspaceId","projectId","createdAt"],"properties":{"exportId":{"$ref":"common.schema.json#/$defs/id"},"sessionId":{"$ref":"common.schema.json#/$defs/id"},"workspaceId":{"$ref":"common.schema.json#/$defs/id"},"projectId":{"$ref":"common.schema.json#/$defs/id"},"createdAt":{"$ref":"common.schema.json#/$defs/timestamp"}}},"restorationId":{"$ref":"common.schema.json#/$defs/id"},"restoredAt":{"$ref":"common.schema.json#/$defs/timestamp"},"replayId":{"$ref":"common.schema.json#/$defs/id"},"replayGeneratedAt":{"$ref":"common.schema.json#/$defs/timestamp"},"personalChatGptMemoryIncluded":{"const":false},"rawPrivateDataIncluded":{"const":false},"externalEffects":{"type":"array","maxItems":0},"synthetic":{"const":true},"consequentialAuthorityGranted":{"const":false}}
}
