{"acceptanceContract":{"authorityAssertions":["Preview acceptance grants no merge or production authority.","Execution requires an exact Clover Handoff Action Envelope."],"consequentialAuthorityGranted":false,"deterministic":true,"documentType":"clover-launch-acceptance-contract","privacyAssertions":["Synthetic fixture data only.","No audio or private record."],"recordHash":"a6e887d81cd4a5e57064a0c4e21a84720abd686810897ee1d080f586536659e9","recordId":"acceptance_contract_synthetic_001","schemaVersion":"0.1.0","sessionId":"launch_session_synthetic_owner_001","synthetic":true,"tests":[{"expected":"Three or more labeled activities are visible.","material":true,"method":"integration","requirement":"Display at least three synthetic activities for today.","testId":"acceptance_activity_list_001"},{"expected":"One selection is visible and reversible.","material":true,"method":"integration","requirement":"Choose exactly one next activity.","testId":"acceptance_choose_one_001"},{"expected":"No clipped controls at 390 CSS pixels.","material":true,"method":"visual","requirement":"Remain usable in a narrow mobile viewport.","testId":"acceptance_mobile_001"}],"visualBrowserPlan":["Desktop and 390-pixel mobile preview inspection after local green."]},"buildCharter":{"acceptanceContractHash":"e6b71f9b77535d818e2dc1c625141621e9624d67709485603e00c657616f097c","allowedPaths":["future-isolated-app/**"],"approvalDoesNotAuthorizeMergeOrProduction":true,"budgetId":"session_budget_synthetic_001","charterApprovalAuthorityReferenceId":"authority_ref_synthetic_charter_001","consequentialAuthorityGranted":false,"contextPackHash":"b1f71a39021ff0b7cb8ef32289476ad16176b072ee2dcbe786f5ee3f7e77e3a8","deliverables":["Future preview-only candidate and verification receipt."],"documentType":"clover-build-charter","exactTarget":"One isolated, synthetic, target-null preview candidate for a fictional activity chooser.","impactScanHash":"e52352d8cda5c2a8a5fe984804de0132548a44eac2c04716f15c89ba62cff9e0","intendedFruit":["The fictional guest sees today’s activities and chooses one next activity."],"intendedUsers":["One fictional retreat guest."],"nonGoals":["No production.","No real user or private data.","No messaging or payment."],"privacyClass":"synthetic","progressReportingContract":["Evidence-backed material deltas only.","No hidden reasoning or chain-of-thought."],"prohibitedEffects":["merge","production-deployment","private-data-ingestion","message","payment","purchase"],"prohibitedPaths":["existing-projects/**","production/**"],"recordHash":"23ada42130f0ec3333bbff31035661af055a80791493e1e0bfa7c8d000d03643","recordId":"build_charter_synthetic_001","repairLoopLimit":3,"rollbackAnchor":"No source or provider effect exists in Phase A.","schemaVersion":"0.1.0","scope":["Future tiny responsive activity chooser."],"sessionId":"launch_session_synthetic_owner_001","sourceAnchor":"synthetic/repository-placeholder@0000000000000000000000000000000000000000","stopConditions":["Repeated failure without new evidence.","Budget exceeded.","Authority mismatch.","Source substitution."],"synthetic":true,"testPlan":["acceptance_activity_list_001","acceptance_choose_one_001","acceptance_mobile_001"],"visualBrowserPlan":["Desktop and 390-pixel mobile preview inspection after local green."]},"charterAuthorityReference":{"actionEnvelopeHash":"c9105e3377171561eadf74ab0a7ed89ec451115b49e1b4c9727a0aa6b8e87d2e","actionEnvelopeId":"handoff_action_synthetic_unapproved_001","actionEnvelopePath":"portfolio/core/handoff/versions/0.1.0/synthetic-proposals/launch-studio-action-envelope.json","approvalAttestationHash":null,"approvalAttestationId":null,"approvalAttestationPath":null,"approvalRail":"APPROVE_BUILD_CHARTER","authoritySystem":"clover-handoff","boundAllowedPathsHash":"32dad2b1f4e6d7e662b46f6c7ae690180ebfab9b12d8f7dbe6864bcfb24de926","boundBaseCommit":null,"boundProhibitedEffectsHash":"c4d52182ac374244c2206f263afcb4823f1265650e4902dd0a0afc746e05f687","boundProjectId":"project_synthetic_activity_chooser_001","boundRecordHash":"23ada42130f0ec3333bbff31035661af055a80791493e1e0bfa7c8d000d03643","boundRecordId":"build_charter_synthetic_001","boundRecordType":"build-charter","boundRepository":null,"boundSessionId":"launch_session_synthetic_owner_001","branchCapsuleHash":"bb0d7c566d6587929b4da0ba8bd8d71245dea3d0976ced047cb7108cead15e2c","branchCapsuleId":"handoff_capsule_synthetic_unapproved_001","branchCapsulePath":"portfolio/core/handoff/versions/0.1.0/synthetic-proposals/launch-studio-branch-capsule.json","consequentialAuthorityGranted":false,"createdAt":"2026-08-23T12:05:00.000Z","documentType":"clover-launch-authority-reference","executionReceiptHash":null,"executionReceiptId":null,"executionReceiptPath":null,"expiresAt":"2026-08-24T12:05:00.000Z","independentAuthoritySystemCreated":false,"independentReviewHash":null,"independentReviewId":null,"independentReviewPath":null,"lifecycle":"proposed","lifecycleIndexHash":"b29fc29e911c6b68e0195aedd1be48bb3dbd8dadad6e37fb64f9ac48ac3f8824","lifecycleIndexPath":"portfolio/core/handoff/versions/0.1.0/synthetic-proposals/launch-studio-lifecycle-index.json","nonAuthorizing":true,"referenceId":"authority_ref_synthetic_charter_001","schemaVersion":"0.1.0","scope":"build-charter","synthetic":true},"consequentialAuthorityGranted":false,"contextPack":{"budgetId":"session_budget_synthetic_001","consequentialAuthorityGranted":false,"documentType":"clover-launch-context-pack","exactOwnerRequest":"Build a tiny app that helps a fictional retreat guest see today’s activities and choose one next activity. Keep the session synthetic and preview-only.","fullConversationCopied":false,"goals":["Show a fictional guest today’s synthetic activities.","Let the fictional guest select one next activity."],"intendedFruit":["A clear next-activity choice without production or private data."],"knownHolds":["Real execution authority is absent."],"priorReceipts":[],"privacyBoundaries":["Synthetic data only.","No personal ChatGPT memory.","No raw private data in public Core."],"productionAnchors":[],"recordHash":"e39499c6edbf2cfd3f8609c87cfe5aa7af868d71735eedd1f1489cc58193d0f5","recordId":"context_pack_synthetic_001","relatedProjects":[],"reusableComponents":["Clover Launch Studio deterministic session engine."],"rollbackAnchors":["Delete only a future isolated synthetic worktree and target-null preview."],"schemaVersion":"0.1.0","sessionId":"launch_session_synthetic_owner_001","sharedResources":{"authentication":[],"databases":[],"domains":[],"providers":[],"repositories":["synthetic/repository-placeholder"]},"sources":[{"contentHash":"6a620736784bbae3b388dfce7e0f52e8ff40fd462fedbd1dcdb59af3732fc1bb","freshness":"current","observedAt":"2026-08-23T12:01:00.000Z","sourceId":"source_synthetic_owner_text_002","sourceType":"synthetic-owner-text"}],"stateAnchors":{"candidate":["A preview proposal only."],"current":["No application exists."],"historical":[]},"synthetic":true,"targetProject":"project_synthetic_activity_chooser_001","unknowns":["Future app boundary and private storage provider are undecided."]},"documentType":"clover-launch-studio-synthetic-session-fixture","executionAuthorityReference":{"actionEnvelopeHash":"c97f8c3790fed166e9ff37976e1fe0dff5e6350bcb2f313e5e26dfb626acb0ea","actionEnvelopeId":"handoff_action_synthetic_execution_unapproved_001","actionEnvelopePath":"portfolio/core/handoff/versions/0.1.0/synthetic-proposals/launch-studio-execution-action-envelope.json","approvalAttestationHash":null,"approvalAttestationId":null,"approvalAttestationPath":null,"approvalRail":"APPROVE_BUILD_CHARTER","authoritySystem":"clover-handoff","boundAllowedPathsHash":"32dad2b1f4e6d7e662b46f6c7ae690180ebfab9b12d8f7dbe6864bcfb24de926","boundBaseCommit":"0000000000000000000000000000000000000000","boundProhibitedEffectsHash":"c4d52182ac374244c2206f263afcb4823f1265650e4902dd0a0afc746e05f687","boundProjectId":"project_synthetic_activity_chooser_001","boundRecordHash":"d77db0bc124d0c95718bf8f2ec42252d8884c86072c27c5c6c9529ac1b01b247","boundRecordId":"executor_work_order_synthetic_001","boundRecordType":"executor-work-order","boundRepository":"synthetic/repository-placeholder","boundSessionId":"launch_session_synthetic_owner_001","branchCapsuleHash":"0d278005bbcfa92259b058a8e92b9b00da257f1497e490a025163c1b5e2eb047","branchCapsuleId":"handoff_capsule_synthetic_execution_unapproved_001","branchCapsulePath":"portfolio/core/handoff/versions/0.1.0/synthetic-proposals/launch-studio-execution-branch-capsule.json","consequentialAuthorityGranted":false,"createdAt":"2026-08-23T12:09:00.000Z","documentType":"clover-launch-authority-reference","executionReceiptHash":null,"executionReceiptId":null,"executionReceiptPath":null,"expiresAt":"2026-08-24T12:09:00.000Z","independentAuthoritySystemCreated":false,"independentReviewHash":null,"independentReviewId":null,"independentReviewPath":null,"lifecycle":"proposed","lifecycleIndexHash":"7a88f7a848dd0388789c92d8bb001f6ea026f22399c3ccfd4e589ae4d2d8ce4d","lifecycleIndexPath":"portfolio/core/handoff/versions/0.1.0/synthetic-proposals/launch-studio-execution-lifecycle-index.json","nonAuthorizing":true,"referenceId":"authority_ref_synthetic_execution_001","schemaVersion":"0.1.0","scope":"executor-work-order","synthetic":true},"executorWorkOrder":{"allowedPaths":["future-isolated-app/**"],"baseCommit":"0000000000000000000000000000000000000000","charterId":"build_charter_synthetic_001","consequentialAuthorityGranted":false,"contextPackHash":"b1f71a39021ff0b7cb8ef32289476ad16176b072ee2dcbe786f5ee3f7e77e3a8","deliverables":["Future preview-only candidate and verification receipt."],"documentType":"clover-executor-work-order","executed":false,"handoffAuthorityReferenceId":"authority_ref_synthetic_execution_001","impactScanHash":"e52352d8cda5c2a8a5fe984804de0132548a44eac2c04716f15c89ba62cff9e0","modelCapabilityPolicy":["high-reasoning","implementation","mechanical","deterministic"],"progressEventContract":["Evidence-backed material deltas only.","No hidden